{
  "version": "1.0.0",
  "last_updated": "2026-02-18",
  "provider": "tiktoken",
  "cache_env_var": "TIKTOKEN_CACHE_DIR",
  "cache_dir": "vendor/tokenizers/tiktoken-cache",
  "encodings": [
    {
      "name": "cl100k_base",
      "source_url": "https://openaipublic.blob.core.windows.net/encodings/cl100k_base.tiktoken",
      "cache_key_sha1": "9b5ad71b2ce5302211f9c61530b329a4922fc6a4",
      "expected_sha256": "223921b76ee99bde995b7ff738513eef100fb51d18c93597a113bcffe865b2a7",
      "cache_file": "vendor/tokenizers/tiktoken-cache/9b5ad71b2ce5302211f9c61530b329a4922fc6a4"
    }
  ]
}
